<?xml version="1.0" encoding="UTF-8"?>
<clients xmlns:xs="http://www.w3.org/2001/XMLSchema-instance"
         xs:noNamespaceSchemaLocation="client.xsd">
    <client>
        <id>1</id>
        <first-name>FirstName1</first-name>
        <last-name>LastName1</last-name>
        <money>1000</money>
        <table>
            <number>1</number>
            <is-free>true</is-free>
        </table>
        <chosen-menu-items>
            <menu-item>
                <name>Soup</name>
                <price>100</price>
            </menu-item>
            <menu-item>
                <name>salad</name>
                <price>70</price>
            </menu-item>
        </chosen-menu-items>
    </client>
    <client>
        <id>4</id>
        <first-name>FirstName4</first-name>
        <last-name>LastName4</last-name>
        <money>800</money>
        <chosen-menu-items/>
    </client>
    <client>
        <id>3</id>
        <first-name>FirstName3</first-name>
        <last-name>LastName3</last-name>
        <money>700</money>
        <table>
            <number>3</number>
            <is-free>true</is-free>
        </table>
        <chosen-menu-items>
            <menu-item>
                <name>Soup</name>
                <price>100</price>
            </menu-item>
            <menu-item>
                <name>meat</name>
                <price>300</price>
            </menu-item>
            <menu-item>
                <name>salad</name>
                <price>70</price>
            </menu-item>
        </chosen-menu-items>
    </client>
    <client>
        <id>2</id>
        <first-name>FirstName2</first-name>
        <last-name>LastName2</last-name>
        <money>1100</money>
        <table>
            <number>2</number>
            <is-free>true</is-free>
        </table>
        <chosen-menu-items>
            <menu-item>
                <name>Soup</name>
                <price>100</price>
            </menu-item>
            <menu-item>
                <name>salad</name>
                <price>70</price>
            </menu-item>
        </chosen-menu-items>
    </client>
    <client>
        <id>5</id>
        <first-name>FirstName5</first-name>
        <last-name>LastName5</last-name>
        <money>100</money>
        <chosen-menu-items/>
    </client>
</clients>
